Develop an ontology dedicated to {noun}.		Develop an ontology dedicated to Work.	Ontology of Work1. Work Structure:    1.1. Employment:        1.1.1. Full-time employment        1.1.2. Part-time employment        1.1.3. Temporary employment        1.1.4. Contractual employment        1.1.5. Freelance employment    1.2. Self-employment:        1.2.1. Business owner        1.2.2. Independent contractor        1.2.3. Entrepreneurship    1.3. Unpaid:        1.3.1. Volunteer work        1.3.2. Internship        1.3.3. Housework2. Work Sector:    2.1. Public Sector    2.2. Private Sector    2.3. Non-Profit Sector3. Job Category:    3.1. White Collar Jobs    3.2. Blue Collar Jobs    3.3. Pink Collar Jobs    3.4. Green Collar Jobs    3.5. Gold Collar Jobs4. Profession:    4.1. Healthcare    4.2. Education    4.3. Engineering    4.4. Finance    4.5. IT and Tech    4.6. Media and Entertainment    4.7. Government    4.8. Skilled Trades5. Work Condition:    5.1. Office-based    5.2. Remote work    5.3. Field work    5.4. Hybrid work6. Job Responsibilities:    6.1. Administrative Tasks    6.2. Management Tasks    6.3. Operational Tasks    6.4. Project-related Tasks    6.5. Customer Service Tasks7. Employee Rights:    7.1. Labor Rights    7.2. Safe and Healthy Environment    7.3. Privacy Rights    7.4. Discrimination and Harassment Protection8. Work Reward:    8.1. Financial Compensation        8.1.1. Salary        8.1.2. Wages        8.1.3. Bonus        8.1.4. Commission    8.2. Benefits        8.2.1. Health Insurance        8.2.2. Retirement Plans        8.2.3. Paid Time Off9. Evaluation:    9.1. Performance Appraisal    9.2. Peer Review    9.3. Customer Feedback    9.4. Self-Evaluation10. Career Development:    10.1. Training and Education    10.2. Promotion    10.3. Skill Upgradation    10.4. Career Transition    10.5. Retirement Planning
Develop an ontology dedicated to {noun}.	 Provide it in valid Turtle/RDF format, excluding any extra text.	Develop an ontology dedicated to Work. Provide it in valid Turtle/RDF format, excluding any extra text.	```@prefix rdf: <http://www.w3.org/1999/02/22-rdf-syntax-ns#> .@prefix rdfs: <http://www.w3.org/2000/01/rdf-schema#> .@prefix owl: <http://www.w3.org/2002/07/owl#> .@prefix xsd: <http://www.w3.org/2001/XMLSchema#> .@prefix work: <http://example.org/work#> .work:Work rdf:type owl:Class ;    rdfs:comment "A class representing works or jobs" ;    rdfs:label "Work" .work:hasPosition rdf:type owl:DatatypeProperty ;    rdfs:comment "Indicates the position title of a work" ;    rdfs:label "has position" ;    rdfs:domain work:Work ;    rdfs:range xsd:string .work:hasLocation rdf:type owl:DatatypeProperty ;    rdfs:comment "Indicates the location of a work" ;    rdfs:label "has location" ;    rdfs:domain work:Work ;    rdfs:range xsd:string .work:hasWorkHours rdf:type owl:DatatypeProperty ;    rdfs:comment "Indicates the work hours of a work" ;    rdfs:label "has work hours" ;    rdfs:domain work:Work ;    rdfs:range xsd:int .work:hasStartDate rdf:type owl:DatatypeProperty ;    rdfs:comment "Indicates the start date of a work" ;    rdfs:label "has start date" ;    rdfs:domain work:Work ;    rdfs:range xsd:date .work:hasEndDate rdf:type owl:DatatypeProperty ;    rdfs:comment "Indicates the end date of a work" ;    rdfs:label "has end date" ;    rdfs:domain work:Work ;    rdfs:range xsd:date .work:Employee rdf:type owl:Class ;    rdfs:comment "A class representing employees" ;    rdfs:label "Employee" .work:isEmployedAt rdf:type owl:ObjectProperty ;    rdfs:comment "Indicates where an employee is employed" ;    rdfs:label "is employed at" ;    rdfs:domain work:Employee ;    rdfs:range work:Work .```
Construct an ontology focused on {noun}.		Construct an ontology focused on Work.	Ontology Class: WorkSubclasses: 1. Employment: A state in which individuals perform tasks for someone else and receive financial or other types of compensation in return.    - Full-time Employment: Regularly scheduled work done by an individual for 35-40 hours per week.        - Sub-classes: Permanent employment, Temporary employment, Probationary employment    - Part-time Employment: Work that involves fewer hours per week than a full-time job.        - Sub-classes: Permanent part-time employment, Temporary part-time employment    - Freelance Work: Independent work performed for different companies without being officially employed.        - Sub-classes: Gig work, Contractual work2. Unemployment: The state of not having a job or not being engaged in a gainful employment.3. Job Seeking: The process of looking for employment, whether as an unemployed or employed individual.    - Subclasses: Job search, Job interview, Job application, Job assessment4. Job Positions: Defines the main roles and tasks individuals take within organisations.    - Subclasses: Managerial positions, Administrative positions, Technical positions, Research positions5. Work Environment: The physical and social aspects of a workplace.    - Subclasses: Remote work, On-site work, Co-working spaces, Corporate culture6. Worker Rights: Legal rights and protections provided to workers.    - Subclasses: Labor laws, Employment contracts, Work safety regulations7. Skilled Work: Work that requires a certain level of skill or training.    - Sub-classes: Professional work, Technical work, Trade work8. Unskilled Work: Work that requires no particular skill or education.    - Sub-classes: Manual work, Labor work 9. Compensation: The return an individual gets for performing work.    - Subclasses: Salary, Wages, Benefits, Bonuses10. Work-life balance: The equilibrium between an individual's job and personal life.    - Subclasses: Flexible working hours, Time off, Family responsibilitiesRelations:1. Employment involves Job Positions2. Job Seeking leads to Employment3. Job Positions require either Skilled Work or Unskilled Work4. Worker Rights protect against Unemployment5. Work Environment affects Work-life balance6. Compensation is a result of Employment.
Construct an ontology focused on {noun}.	 Provide it in valid Turtle/RDF format, excluding any extra text.	Construct an ontology focused on Work. Provide it in valid Turtle/RDF format, excluding any extra text.	```turtle@prefix rdf: <http://www.w3.org/1999/02/22-rdf-syntax-ns#> .@prefix rdfs: <http://www.w3.org/2000/01/rdf-schema#> .@prefix owl: <http://www.w3.org/2002/07/owl#> .@prefix xsd: <http://www.w3.org/2001/XMLSchema#> .@prefix wo: <http://example.com/work_ontology#> .wo:Work a rdfs:Class ;    rdfs:label "Work"@en ;    rdfs:comment "A class representing any type of work or employment."@en .wo:Job a rdfs:Class ;    rdfs:subClassOf wo:Work ;    rdfs:label "Job"@en ;    rdfs:comment "A regular remunerative position."@en .wo:FreelanceJob a rdfs:Class ;    rdfs:subClassOf wo:Job ;    rdfs:label "Freelance Job"@en ;    rdfs:comment "A job in which a person works for themselves, rather than for a company."@en .wo:FullTimeJob a rdfs:Class ;    rdfs:subClassOf wo:Job ;    rdfs:label "Full-time Job"@en ;    rdfs:comment "A job that requires working for a full set of hours per week."@en .wo:PartTimeJob a rdfs:Class ;    rdfs:subClassOf wo:Job ;    rdfs:label "Part-time Job"@en ;    rdfs:comment "A job that requires working for less than the normal hours per week."@en .wo:title a rdf:Property ;    rdfs:domain wo:Work ;    rdfs:range xsd:string ;    rdfs:comment "A title or name of the work."@en .wo:organization a rdf:Property ;    rdfs:domain wo:Work ;    rdfs:range xsd:string ;    rdfs:comment "The organization or company the work is for."@en .wo:location a rdf:Property ;    rdfs:domain wo:Work ;    rdfs:range xsd:string ;    rdfs:comment "The location where the work takes place."@en .wo:description a rdf:Property ;    rdfs:domain wo:Work ;    rdfs:range xsd:string ;    rdfs:comment "Description of the work."@en .wo:startDate a rdf:Property ;    rdfs:domain wo:Work ;    rdfs:range xsd:date ;    rdfs:comment "Date when the work starts."@en .wo:endDate a rdf:Property ;    rdfs:domain wo:Work ;    rdfs:range xsd:date ;    rdfs:comment "Date when the work ends."@en .wo:salary a rdf:Property ;    rdfs:domain wo:Job ;    rdfs:range xsd:decimal ;    rdfs:comment "The remuneration for the job."@en .wo:hoursPerWeek a rdf:Property ;    rdfs:domain wo:Job ;    rdfs:range xsd:integer ;    rdfs:comment "The number of hours needed to work per week for the job."@en .```
Build an ontology surrounding the concept of a {noun}.		Build an ontology surrounding the concept of a Work.	An ontology surrounding the concept of a Work can be represented as follows:1. Concept: Work    - Definition: An activity, involving mental or physical effort, done in order to achieve a result.    2. Sub-concepts:    - Employment: A relationship between two parties, usually based on a contract.        - Full-time: Working at least the full standard hours as defined in a specific region.        - Part-time: Working less than the full standard hours.        - Self-employed: Working for oneself as a freelancer or the owner of a business rather than for an employer.        - Temporary: An employment situation where the working arrangement lasts only for a certain period of time.           - Volunteer Work: An unpaid activity where an individual gives time to benefit another person or organization.    - Manual Work: Work involving physical labour.        - Agriculture: Manual work related to farming or cultivation of plants.        - Construction: Majority of manual work related to building infrastructure.    - Intellectual Work: Work involving mental or cognitive abilities.        - Creative Work: Includes writing, artwork, music composition etc.        - Academic Work: Includes researching, teaching etc.        - Professional Work: Includes technical work like engineering, law, medicine etc.    3. Properties:    - Working Hours: The hours during which an employee works.    - Work Location: The location where the work is performed.    - Job Description: Description of all tasks and requirements for a job.    - Salary: The remuneration received by an employee for work performed.    - Skill Requirements: The skills that are required to do the work.4. Related Concepts:    - Worker: A person who performs or executes the work.    - Work Environment: The surrounding conditions in which an employee operates while performing a job.    - Job Satisfaction: The extent to which an employee is content with the work they do. 5. Attributes:    - Nature of Work: The type or characteristics of the work.    - Level of Skill required: The proficiency or competence required to perform the work.    - Stress Level: The amount of mental, emotional or physical strain caused by the work. 6. Processes:    - Hiring: Process of acquiring personnel for work.    - Task Assignment: Process of allocating work or tasks.    - Performance Evaluation: Process of assessing the quality or effectiveness of work.    - Promotion: Process of elevating an employee's rank or position based on their work performance.    - Retirement: Disconnecting from their work life based on age or personal choice. Different philosophies, cultural environments, and individuals may have varying perceptions of what constitutes "work", so this ontology can be modified or extended to fit specific contexts.
Build an ontology surrounding the concept of a {noun}.	 Provide it in valid Turtle/RDF format, excluding any extra text.	Build an ontology surrounding the concept of a Work. Provide it in valid Turtle/RDF format, excluding any extra text.	```@prefix rdf: <http://www.w3.org/1999/02/22-rdf-syntax-ns#> .@prefix rdfs: <http://www.w3.org/2000/01/rdf-schema#> .@prefix owl: <http://www.w3.org/2002/07/owl#> .@prefix xsd: <http://www.w3.org/2001/XMLSchema#> .@prefix work: <http://example.org/work#> .work:Work     rdf:type rdfs:Class ;    rdfs:comment "A class representing the concept of work."@en ;    rdfs:label "Work"@en .work:hasOccupation     rdf:type owl:ObjectProperty ;    rdfs:label "has Occupation"@en ;    rdfs:comment "The occupation associated with the work."@en ;    rdfs:domain work:Work ;    rdfs:range work:Occupation .work:hasLocation     rdf:type owl:ObjectProperty ;    rdfs:label "has location"@en ;    rdfs:comment "The location where the work is done."@en ;    rdfs:domain work:Work ;    rdfs:range work:Location .work:hasStartTime      rdf:type owl:DatatypeProperty ;    rdfs:label "has start time"@en ;    rdfs:comment "The start time of the work."@en ;    rdfs:domain work:Work ;    rdfs:range xsd:dateTime .work:hasEndTime       rdf:type owl:DatatypeProperty ;    rdfs:label "has end time"@en ;    rdfs:comment "The end time of the work."@en ;    rdfs:domain work:Work ;    rdfs:range xsd:dateTime .work:Occupation     rdf:type owl:Class ;    rdfs:comment "A class representing the concept of occupation."@en ;    rdfs:label "Occupation"@en .work:Location     rdf:type owl:Class ;    rdfs:comment "A class representing the concept of location."@en ;    rdfs:label "Location"@en .```
Formulate an ontology related to {noun}.		Formulate an ontology related to Work.	Class: Worker- Sub-class: Full-time worker- Sub-class: Part-time worker- Sub-class: Remote worker- Sub-class: Contract worker- Sub-class: FreelancerClass: Work Environment- Sub-class: Office- Sub-class: Work from home- Sub-class: Co-working space- Sub-class: OutdoorClass: Work Equipment- Sub-class: Computer/Laptop- Sub-class: Workstation- Sub-class: Office supplies- Sub-class: MachineryClass: Work Role- Sub-class: Manager- Sub-class: Employee- Sub-class: Intern- Sub-class: Executive- Sub-class: Team leaderClass: Work Skill- Sub-class: Technical skills- Sub-class: Soft skills- Sub-class: Management skills- Sub-class: Artistic skills- Sub-class: Communication skillsClass: Working Hours- Sub-class: Day shift- Sub-class: Night shift- Sub-class: Flexible hours- Sub-class: Part-time hoursClass: Work Tasks- Sub-class: Administrative tasks- Sub-class: Creative tasks- Sub-class: Technical tasks- Sub-class: Manual tasksClass: Employment Type- Sub-class: Permanent job- Sub-class: Temporarily job- Sub-class: Contract job- Sub-class: InternshipClass: Work Performance- Sub-class: Work productivity- Sub-class: Work quality- Sub-class: Work output- Sub-class: Work ethicsClass: Work related Stress- Sub-class: Workload- Sub-class: Burnout- Sub-class: Work-life balance- Sub-class: Conflict in workplaceClass: Compensation- Sub-class: Salary- Sub-class: Bonus- Sub-class: Benefits- Sub-class: CommissionClass: Job Satisfaction- Sub-class: Fulfillment- Sub-class: Work-life balance- Sub-class: Recognition- Sub-class: Career GrowthClass: Corporation- Sub-class: Start-up- Sub-class: MNC- Sub-class: Non-profit- Sub-class: Government OrganisationClass: Career Advancement- Sub-class: Promotion- Sub-class: Training and development- Sub-class: Mentoring- Sub-class: Job rotation
Formulate an ontology related to {noun}.	 Provide it in valid Turtle/RDF format, excluding any extra text.	Formulate an ontology related to Work. Provide it in valid Turtle/RDF format, excluding any extra text.	```@prefix : <http://example.org/work#> .@prefix rdf: <http://www.w3.org/1999/02/22-rdf-syntax-ns#> .@prefix rdfs: <http://www.w3.org/2000/01/rdf-schema#> .@prefix xsd: <http://www.w3.org/2001/XMLSchema#> .:Employee rdf:type rdfs:Class .:Employer rdf:type rdfs:Class .:Job rdf:type rdfs:Class .:jobTitle rdf:type rdf:Property ;      rdfs:domain :Job ;      rdfs:range xsd:string .:startDate rdf:type rdf:Property ;      rdfs:domain :Job ;      rdfs:range xsd:date .:endDate rdf:type rdf:Property ;      rdfs:domain :Job ;      rdfs:range xsd:date .:worksFor rdf:type rdf:Property ;      rdfs:domain :Employee ;      rdfs:range :Employer .:employed rdf:type rdf:Property ;      rdfs:domain :Employer ;      rdfs:range :Employee .:hasJob rdf:type rdf:Property ;      rdfs:domain :Employee ;      rdfs:range :Job .```
Establish an ontology based on {noun}.		Establish an ontology based on Work.	Ontology is a set of concepts and categories in a subject area or domain that shows their properties and the relations between them.Here is a proposed ontology based on Work:1. **Work**      - Definition: A task or series of tasks carried out to achieve a desired result or outcome.2. **Types of work**      - Full-time work             - Definition: Commitment to work for at least 40 hours per week.      - Part-time work             - Definition: Commitment to work for less than 35-40 hours per week.      - Remote work             - Definition: Performing work duties from a non-traditional environment, typically home.      - Temporary work             - Definition: Employment that does not continue indefinitely but for a specific period of time.      - Freelance work             - Definition: Self-employment, wherein a person offers services to businesses or individuals.3. **Workplace**      - Definition: The location where work is performed.           - Office: A location where office-related work is performed.           - Home: A location used for remote work.           - Field: The location for field-specific work tasks.4. **Workers**      - Definition: Individuals who perform work.           - Employee: A person employed for wages or salary.           - Employer: A person or organization that employs people.           - Independent contractor: A person or entity contracted to perform work for another entity as a non-employee.5. **Work outputs**      - Definition: The result or product produced by work.           - Products: Goods manufactured by working.           - Services: Non-tangible goods produced by work.6. **Work ethics**      - Definition: Values-based principles that guide work behaviors.           - Integrity: Honest and strong moral principles at work.           - Accountability: Taking responsibility for actions and decisions.7. **Work conditions**      - Definition: The surroundings and circumstances of a person's workplace.           - Physical conditions: The tangible aspects of the workplace environment.           - Psychological conditions: The mental and emotional factors present in the workplace.8. **Work laws**      - Definition: Legal rights and responsibilities of workers and employers.           - Labor laws: Laws designed to protect workers' rights.           - Employment contracts: Legal agreements between employers and employees describing the terms of employment.9. **Work benefits**      - Definition: A form of compensation, in addition to actual earnings.           - Health insurance: Insurance against the risk of incurring health expenses.           - Retirement plan: An arrangement by employers for the payment of retirement benefits.10. **Work hours**     - Definition: The hours during which employees are expected to work.           - Overtime: Time worked beyond the standard workweek.           - Flexible hours: A schedule that allows employees to choose their working hours within limits.
Establish an ontology based on {noun}.	 Provide it in valid Turtle/RDF format, excluding any extra text.	Establish an ontology based on Work. Provide it in valid Turtle/RDF format, excluding any extra text.	```ttl@prefix rdf: <http://www.w3.org/1999/02/22-rdf-syntax-ns#> .@prefix rdfs: <http://www.w3.org/2000/01/rdf-schema#> .@prefix owl: <http://www.w3.org/2002/07/owl#> .@prefix xsd: <http://www.w3.org/2001/XMLSchema#> .@prefix work: <http:/example.org/work#> .# Defining Classeswork:Work rdf:type owl:Class .work:Employment rdf:type owl:Class .work:Location rdf:type owl:Class .work:Role rdf:type owl:Class .# Defining Subclasseswork:FullTime rdf:type owl:Class ;    rdfs:subClassOf work:Employment .work:PartTime rdf:type owl:Class ;    rdfs:subClassOf work:Employment .# Defining Propertieswork:hasRole rdf:type owl:ObjectProperty ;    rdfs:domain work:Work ;    rdfs:range work:Role .work:atLocation rdf:type owl:ObjectProperty ;    rdfs:domain work:Work ;    rdfs:range work:Location .work:hasEmploymentType rdf:type owl:ObjectProperty ;    rdfs:domain work:Work ;    rdfs:range work:Employment .work:name rdf:type owl:DatatypeProperty ;    rdfs:domain work:Location ;    rdfs:range xsd:string .work:description rdf:type owl:DatatypeProperty ;    rdfs:domain work:Role ;    rdfs:range xsd:string .work:hoursPerWeek rdf:type owl:DatatypeProperty ;    rdfs:domain work:Employment ;    rdfs:range xsd:decimal .```
Design an ontology to encompass {noun}.		Design an ontology to encompass Work.	Work Ontology:1. Class: Work   - SubClass: Employment       - SubClass: Full-Time Employment           - Property: workHours (Number)           - Property: ProfessionalDevelopment (Boolean)           - Property: Benefits (List)       - SubClass: Part-Time Employment           - Property: workHours (Number)           - Property: ProfessionalDevelopment (Boolean)           - Property: Benefits (List)       - SubClass: Freelance           - Property: workHours (Number)           - Property: ProfessionalDevelopment (Boolean)   - SubClass: Labor       - SubClass: Physical Labor           - Property: SkillsRequired (List)       - SubClass: Mental Labor           - Property: SkillsRequired (List)   - SubClass: Unemployment       - Property: Duration (Number)       - Property: UnemployedBenefits (List)2. Class: Workplace   - Property: Location (Address)   - Property: WorkingConditions (Description)   - Property: SafetyMeasures (List)   - Property: EmployeeRights (List)3. Class: JobRole   - Property: Title (String)   - Property: Description (String)   - Property: Salary (Number)   - Property: RequiredExperience (Number)   - Property: RequiredQualifications (List)4. Class: Employee   - Property: Name (String)   - Property: Age (Number)   - Property: Gender (String)   - Property: Experience (Number)   - Property: Qualifications (List)5. Class: Employer   - Property: CompanyName (String)   - Property: Industry (String)   - Property: Location (Address)6. Class: WorkersUnion   - Property: UnionName (String)   - Property: MemberCount (Number)   - Property: Benefits (List)7. Class: RegulatoryBodies   - Property: Name (String)   - Property: Jurisdiction (String)   - Property: Regulations (List) 8. Class: Legislation   - SubClass: WorkerRightsAct       - Property: Year (Number)   - SubClass: MinimumWageAct       - Property: Year (Number)Note: This is a basic structure of a Work Ontology. The subclasses and properties can be extended based on the specific needs of the application.
Design an ontology to encompass {noun}.	 Provide it in valid Turtle/RDF format, excluding any extra text.	Design an ontology to encompass Work. Provide it in valid Turtle/RDF format, excluding any extra text.	```turtle@prefix rdf: <http://www.w3.org/1999/02/22-rdf-syntax-ns#> .@prefix rdfs: <http://www.w3.org/2000/01/rdf-schema#> .@prefix owl: <http://www.w3.org/2002/07/owl#> .@prefix xsd: <http://www.w3.org/2001/XMLSchema#> .@prefix ex: <http://example.org/work#> .ex:Work  rdf:type owl:Class ;  rdfs:label "Work" ;  rdfs:subClassOf owl:Thing ;.ex:Employee  rdf:type owl:Class ;  rdfs:label "Employee" ;  rdfs:subClassOf ex:Work ;.ex:Employer  rdf:type owl:Class ;  rdfs:label "Employer" ;  rdfs:subClassOf ex:Work ;.ex:tasks  rdf:type owl:ObjectProperty ;  rdfs:label "tasks" ;  rdfs:range ex:Task ;.ex:Task  rdf:type owl:Class ;  rdfs:label "Task" ;  rdfs:subClassOf ex:Work ;.ex:role  rdf:type owl:DatatypeProperty ;  rdfs:label "role" ;  rdfs:range xsd:string ;.ex:salary  rdf:type owl:DatatypeProperty ;  rdfs:label "salary" ;  rdfs:range xsd:float ;.ex:WorkPeriod  rdf:type owl:Class ;  rdfs:label "WorkPeriod" ;  rdfs:subClassOf ex:Work ;.ex:startDate  rdf:type owl:DatatypeProperty ;  rdfs:label "startDate" ;  rdfs:range xsd:date ;.ex:endDater rdf:type owl:DatatypeProperty ;  rdfs:label "endDate" ;  rdfs:range xsd:date ;.```
Generate an ontology that covers {noun}.		Generate an ontology that covers Work.	1. Work   1.1 Types of Work      1.1.1 Full-time work      1.1.2 Part-time work      1.1.3 Remote work      1.1.4 Work from home      1.1.5 Gig economy      1.1.6 Contract work      1.1.7 Self-employment      1.1.8 Seasonal work   1.2 Work Environment      1.2.1 Office      1.2.2 Warehouse      1.2.3 Outdoors      1.2.4 Home      1.2.5 Remote locations   1.3 Sectors of Work      1.3.1 Public sector      1.3.2 Private sector      1.3.3 Non-profit sector      1.3.4 Gig economy   1.4 Work Responsibility      1.4.1 Managerial      1.4.2 Operations      1.4.3 Administrative      1.4.4 Customer service      1.4.5 Technical      1.4.6 Creative   1.5 Work Skills      1.5.1 Soft skills      1.5.2 Hard skills      1.5.3 Transferable skills   1.6 Work Tools & Technology      1.6.1 Computer and software      1.6.2 Machinery      1.6.3 Vehicles      1.6.4 Communication tools   1.7 Work Relationships      1.7.1 Co-workers      1.7.2 Managers      1.7.3 Subordinates   1.8 Work Compensation      1.8.1 Salary      1.8.2 Hourly wage      1.8.3 Contract payment      1.8.4 Commission      1.8.5 Benefits   1.9 Work Laws and Regulations      1.9.1 Labor laws      1.9.2 Occupational safety and health regulations      1.9.3 Employment contracts      1.9.4 Discrimination and harassment laws   1.10 Work Life Balance      1.10.1 Flexible hours      1.10.2 Vacation time      1.10.3 Maternity/Paternity leave      1.10.4 Stress management   1.11 Job Search      1.11.1 Job postings      1.11.2 Job interviews      1.11.3 Resumes and cover letters      1.11.4 Networking      1.11.5 Job offers   1.12 Work Training and Education      1.12.1 Professional development      1.12.2 Educational requirements      1.12.3 Certificates and licenses      1.12.4 Internships and apprenticeships   1.13 Career Progression      1.13.1 Promotions      1.13.2 Job transitions      1.13.3 Retirement
