Formulate an ontology related to  the following: {noun}.		Formulate an ontology related to  the following: Work.	1. Work Entity: Contains attributes such as type of work, location, sector, tasks, work-related equipment, compensation, work hours, and work status (full time, part time, contract).2. Worker Entity: Contains details such as name, age, education, skills, experience, specializations. It is linked to the work entity through relationships like "performs," "has successfully completed," or "is assigned to."3. Organisation Entity: Comprises information like name, type (private, public, NGO), size, sector, physical and online address. Related to the Work and Worker entities through relationships like "provides" work and "employs" workers.4. Task Entity: This represents individual tasks contained in a job role. It is associated with the work and worker entities.5. Skill Entity: This represents distinct skills required or gained at work. Associated with workers and specific tasks.6. Equipment Entity: Encompasses all tools, machinery, or technology used in a workplace. Linked to specific tasks or work types.7. Compensation Entity: Represents all forms of payment for work including salary, bonuses, commissions, and benefits. It has attributes like payment frequency, method, and amount, and is linked with the work and worker entities.8. Training Entity: Represents all forms of professional learning opportunities. Connected with worker and skill entities through relationships like "improves", "builds", or "offers."9. Sector Entity: Includes the sector or industry, like healthcare, education, technology, construction. Linked to the work and organization entities.10. Law and Regulation Entity: This contains all laws, rules, and regulations surrounding work, such as employment laws, safety regulations, and business practices. This applies to all other entities. 11. Unions and Associations Entity: Represents worker unions and professional associations. Linked to the worker entity through relationships such as "member of" or "represented by."12. Health and Safety Entity: Contains all information relating to health and safety at work. Associated with the work, worker and equipment entities, it might involve risk assessments, safety procedures, and protocols.13. Work Rights Entity: Represents individual's rights within a workplace, this could include right to fair pay, right to privacy, etc. Associated with worker, organisation, law, and regulation entities.  
Formulate an ontology related to  the following: {noun}.	 Provide it in valid Turtle/RDF format, excluding any extra text.	Formulate an ontology related to  the following: Work. Provide it in valid Turtle/RDF format, excluding any extra text.	@prefix rdf: <http://www.w3.org/1999/02/22-rdf-syntax-ns#> .@prefix rdfs: <http://www.w3.org/2000/01/rdf-schema#> .@prefix xsd: <http://www.w3.org/2001/XMLSchema#> .@prefix work: <http://www.example.com/work#> .work:Work  rdf:type rdfs:Class .work:fullTime  rdf:type rdfs:Class ;  rdfs:subClassOf work:Work .work:partTime   rdf:type rdfs:Class ;  rdfs:subClassOf work:Work . work:jobTitle  rdf:type rdf:Property ;  rdfs:domain work:Work ;  rdfs:range xsd:string .work:employer  rdf:type rdf:Property ;  rdfs:domain work:Work ;  rdfs:range xsd:string .work:employee    rdf:type rdf:Property ;    rdfs:domain work:Work ;    rdfs:range xsd:string .work:startDate  rdf:type rdf:Property ;  rdfs:domain work:Work ;  rdfs:range xsd:date .work:endDate  rdf:type rdf:Property ;  rdfs:domain work:Work ;  rdfs:range xsd:date . work:Job1  rdf:type work:fullTime ;  work:jobTitle "Software Developer" ;  work:employer "TechCompany Ltd." ;  work:employee "John Doe" ;  work:startDate "2021-01-01"^^xsd:date ;  work:endDate " "^^xsd:date . work:Job2  rdf:type work:partTime ;  work:jobTitle "Data Analyst" ;  work:employer "Analytics Ltd." ;  work:employee "Jane Doe" ;  work:startDate "2020-05-01"^^xsd:date ;  work:endDate "2022-01-31"^^xsd:date .
Establish an ontology based on the following: {noun}.		Establish an ontology based on the following: Work.	I. Work (Main Concept)   A. Definitions       1. Employment      2. Occupation      3. Profession      4. Job      5. Career   B. Types of Work       1. Full-time      2. Part-time      3. Freelance      4. Contractual      5. Seasonal      6. Remote   C. Work Sectors       1. Private sector      2. Public sector      3. Non-profit sector      4. Education sector      5. Health sector      6. Tech sector   D. Job Titles       1. Manager      2. CEO      3. Engineer      4. Teacher      5. Doctor      6. Designer   E. Work skills      1. Communication      2. Leadership      3. Technical      4. Problem solving      5. Creativity   F. Work environment      1. Office      2. Factory      3. Home      4. Outdoor   G. Work Benefits       1. Salary      2. Health insurance      3. Pension      4. Vacation time   H. Work Rights and Regulations      1. Labor law      2. Workers' rights      3. Workplace safety   I. Work Tools and Equipment      1. Computers      2. Machinery      3. Vehicles      4. Software tools   J. Work Culture      1. Work ethics      2. Job satisfaction      3. Teamwork      4. Diversity and Inclusion   K. Work Related Issues      1. Unemployment      2. Overwork      3. Job security      4. Discrimination   L. Future of Work      1. Automation      2. Gig Economy      3. Artificial Intelligence at Work      4. Remote and Flexible work.
Establish an ontology based on the following: {noun}.	 Provide it in valid Turtle/RDF format, excluding any extra text.	Establish an ontology based on the following: Work. Provide it in valid Turtle/RDF format, excluding any extra text.	@prefix rdf: <http://www.w3.org/1999/02/22-rdf-syntax-ns#> .@prefix rdfs: <http://www.w3.org/2000/01/rdf-schema#> .@prefix xsd: <http://www.w3.org/2001/XMLSchema#> .@prefix owl: <http://www.w3.org/2002/07/owl#> .@prefix work: <http://example.org/work#> .work:Work rdf:type rdfs:Class ;    rdfs:comment "A class representing all kinds of work"^^xsd:string ;    rdfs:label "Work"^^xsd:string .work:Job rdf:type rdfs:Class ;    rdfs:subClassOf work:Work ;    rdfs:label "Job"^^xsd:string ;    rdfs:comment "A class representing formal employment"^^xsd:string .work:Task rdf:type rdfs:Class ;    rdfs:subClassOf work:Work ;    rdfs:label "Task"^^xsd:string ;    rdfs:comment "A class representing a specific piece of work or assignment"^^xsd:string .work:Volunteer rdf:type rdfs:Class ;    rdfs:subClassOf work:Work ;    rdfs:label "Volunteer"^^xsd:string ;    rdfs:comment "A class representing unpaid work, often for a charitable cause"^^xsd:string .work:startDate rdf:type owl:DatatypeProperty ;    rdfs:range xsd:dateTime ;    rdfs:domain work:Work ;    rdfs:label "start date"^^xsd:string ;    rdfs:comment "The start date of a work"^^xsd:string .work:endDate rdf:type owl:DatatypeProperty ;    rdfs:range xsd:dateTime ;    rdfs:domain work:Work ;    rdfs:label "end date"^^xsd:string ;    rdfs:comment "The end date of a work"^^xsd:string .work:worker rdf:type owl:ObjectProperty ;    rdfs:domain work:Work ;    rdfs:range work:Worker ;    rdfs:label "worker"^^xsd:string ;    rdfs:comment "The person who does the work"^^xsd:string .work:Worker rdf:type owl:Class ;    rdfs:label "Worker"^^xsd:string ;    rdfs:comment "A class representing person who is doing work"^^xsd:string .
Design an ontology to encompass the following: {noun}.		Design an ontology to encompass the following: Work.	An ontology is a formal way to describe relationships between entities. Here is an ontology design related to the general concept of "Work".1. Concept: Work   - Properties:         - Location (Physical place or remote)        - Time (Start time, End time)        - Duration (Hours per week)        - Category (Type of work: employment, volunteering, freelancing)        - Compensation (Salary, hourly rate, pro bono)     2. Sub-Concept: Job    - Properties:         - Job title (Software engineer, teacher, nurse, etc.)        - Job description (Duties)        - Requirements (Skills, education, experience)    - Relations:        - Part of: Work         3. Sub-Concept: Organization    - Properties:         - Name         - Industry (Healthcare, IT, Education, etc.)        - Size (Number of employees)    - Relations:        - Assists: Work        - Offers: Job   4. Sub-Concept: Employee   - Properties:         - Name        - Employee ID        - Job title        - Skills   - Relations:        - Does: Work        - Holds: Job        - Part of: Organization   5. Sub-Concept: Employer    - Properties:        - Name        - Employer ID    - Relations:        - Gives: Work        - Governs: Job        - Owns: Organization   6. Sub-Concept: Workplace    - Properties:        - Address        - Building Name         - Working hours    - Relations:        - Site for: Work        - Contains: Job, Employee, EmployerThis ontology could be further expanded or modified, as the concept of "work" is both broad and multifaceted, potentially incorporating elements like task assignments, job intensity, performance appraisals, career progression, and more.
Design an ontology to encompass the following: {noun}.	 Provide it in valid Turtle/RDF format, excluding any extra text.	Design an ontology to encompass the following: Work. Provide it in valid Turtle/RDF format, excluding any extra text.	@prefix xsd: <http://www.w3.org/2001/XMLSchema#> .@prefix rdf: <http://www.w3.org/1999/02/22-rdf-syntax-ns#> .@prefix owl: <http://www.w3.org/2002/07/owl#> .@prefix rdfs: <http://www.w3.org/2000/01/rdf-schema#> .@prefix work: <http://www.example.org/ontology/work#> .work:Work rdf:type owl:Class .work:hasEmployer rdf:type owl:ObjectProperty ;rdfs:domain work:Work ;rdfs:range work:Employer .work:hasEmployee rdf:type owl:ObjectProperty ;rdfs:domain work:Employer ;rdfs:range work:Employee .work:hasPosition rdf:type owl:ObjectProperty ;rdfs:domain work:Work ;rdfs:range work:Position .work:Employee rdf:type owl:Class .work:Employer rdf:type owl:Class .work:Position rdf:type owl:Class .work:hasStartDate rdf:type owl:DatatypeProperty ;rdfs:domain work:Work ;rdfs:range xsd:date .work:hasEndDate rdf:type owl:DatatypeProperty ;rdfs:domain work:Work ;rdfs:range xsd:date .work:hasFullName rdf:type owl:DatatypeProperty ;rdfs:domain work:Employee ;rdfs:range xsd:string .work:hasCompanyName rdf:type owl:DatatypeProperty ;rdfs:domain work:Employer ;rdfs:range xsd:string .work:hasJobTitle rdf:type owl:DatatypeProperty ;rdfs:domain work:Position ;rdfs:range xsd:string .
Generate an ontology that covers the following: {noun}.		Generate an ontology that covers the following: Work.	1. Work    - Definition: A set of tasks or activities performed to accomplish a specific goal or objective. It often refers to professional, employment-related tasks, but can also include nonprofessional activities.2. Categories of Work    - Professional Work        - White Collar Jobs: Work that is performed in an office, cubicle, or other administrative setting.        - Blue Collar Jobs: Work that requires manual labor and physical effort.        - Gig Work: Short-term, flexible jobs where individuals are hired as independent contractors or freelancers.        - Government Jobs: Work for a local, state, or federal government institution.        - Non-profit Jobs: Work for a non-profit organization or charity.    - Non-Professional Work        - Household Chores: Tasks or work done to maintain and run a household.        - Volunteer Work: Unpaid work, usually for a charitable group or organization.        - Community Service: Voluntary work intended to help people in a particular area.        - Homework / School Work: Academic work assigned to students.3. Elements of Work    - Work Tasks: Specific activities or pieces of work to be done to complete a larger project.    - Work Schedule: The timing for when work tasks should be executed.    - Work Environment: The physical and social factors in the place where work is done.    - Work Tools/Equipment: Items used to perform work tasks.    - Work Ethics: The moral principles that govern a person's behavior at work.    - Work-Life Balance: The balance between work responsibilities and personal life.4. Evaluation of Work    - Work Performance: The effectiveness, efficiency, and reliability of an employee at work.    - Work Satisfaction: The level of happiness and fulfillment obtained from one's work.    - Work Reviews/Evaluations: A periodic assessment of an employee's job performance and overall contribution to the organization.    - Pay/Salary/Compensation: Monetary reward for work.5. Work Laws and Rights    - Labor Laws: Laws related to the rights and obligations of workers.    - Employee Rights: The legal rights and protections of workers.    - Employers Obligations: the responsibilities and requirements of employers towards their workers.    - Work Health and Safety Regulations: Rules intended to protect workers from health hazards and unsafe work conditions.6. Transition of Work    - Job Change: The process of leaving one job and starting another.    - Retirement: The point at which a person chooses to stop employment completely.    - Unemployment: The state of being without work, but actively seeking it.    - Career Progression/Advancement: The upward trajectory or progress in one's profession.
Generate an ontology that covers the following: {noun}.	 Provide it in valid Turtle/RDF format, excluding any extra text.	Generate an ontology that covers the following: Work. Provide it in valid Turtle/RDF format, excluding any extra text.	@prefix rdf: <http://www.w3.org/1999/02/22-rdf-syntax-ns#> .@prefix rdfs: <http://www.w3.org/2000/01/rdf-schema#> .@prefix owl: <http://www.w3.org/2002/07/owl#> .@prefix xsd: <http://www.w3.org/2001/XMLSchema#> .@prefix work: <http://www.example.org/work#> .work:Work rdf:type owl:Class ;    rdfs:label "Work" ;    rdfs:comment "Different types of work or jobs" .work:hasEmployee rdf:type owl:ObjectProperty ;    rdfs:domain work:Work ;    rdfs:range work:Employee ;    rdfs:label "has employee" ;    rdfs:comment "The employee who is doing the work" .work:Employee rdf:type owl:Class ;    rdfs:label "Employee" ;    rdfs:comment "Individual who works for a company or organization" .work:hasPosition rdf:type owl:ObjectProperty ;    rdfs:domain work:Employee ;    rdfs:range work:Position ;    rdfs:label "has position" ;    rdfs:comment "The position or job title of the employee" .work:Position rdf:type owl:Class ;    rdfs:label "Position" ;    rdfs:comment "The specific role or title that an employee holds" .work:hasSalary rdf:type owl:DatatypeProperty ;    rdfs:domain work:Position ;    rdfs:range xsd:decimal ;    rdfs:label "has salary" ;    rdfs:comment "The salary for a specific position" .work:hasDuration rdf:type owl:DatatypeProperty ;    rdfs:domain work:Work ;    rdfs:range xsd:duration ;    rdfs:label "has duration" ;    rdfs:comment "The duration of the work" .
Produce an ontology specifically for the following: {noun}.		Produce an ontology specifically for the following: Work.	I. Work  - A. Profession      1. Medical          a. Doctor          b. Nurse          c. Surgeon          d. Psychiatrist      2. Education          a. Teacher          b. Professor          c. Tutor          d. Administrator      3. Engineering          a. Mechanical engineer          b. Civil engineer          c. Electrical engineer          d. Software engineer  - B. Workplace      1. Office          a. Cubicle          b. Meeting room          c. Conference room          d. Lunchroom      2. Hospital          a. Ward          b. Operating room          c. Pharmacy          d. Reception      3. School          a. Classroom          b. Staffroom          c. Library          d. Cafeteria  - C. Work Tools      1. Computer          a. Software          b. Hardware      2. Medical Equipment           a. Stethoscope          b. Scalpel          c. Monitor          d. Wheelchair      3. Teaching Aids          a. Blackboard          b. Projector          c. Textbook  - D. Work Ethics      1. Honesty      2. Accountability      3. Commitment      4. Respect  - E. Work Schedule      1. Full-time      2. Part-time      3. Shift work      4. Telecommuting  - F. Work Relations      1. Colleague      2. Supervisor      3. Subordinate      4. Client  - G. Work Compensation      1. Salary      2. Wage      3. Benefits      4. Bonus  - H. Work Laws      1. Labour laws      2. Health and safety laws      3. Discrimination laws      4. Compensation laws
Produce an ontology specifically for the following: {noun}.	 Provide it in valid Turtle/RDF format, excluding any extra text.	Produce an ontology specifically for the following: Work. Provide it in valid Turtle/RDF format, excluding any extra text.	```ttl@prefix schema: <http://schema.org/> .@prefix rdf: <http://www.w3.org/1999/02/22-rdf-syntax-ns#> .@prefix rdfs: <http://www.w3.org/2000/01/rdf-schema#> .@prefix owl: <http://www.w3.org/2002/07/owl#> .<http://example.com/ontology/Work>  rdf:type owl:Ontology ;  rdfs:comment "Ontology for the domain of Work" .schema:JobPosting  rdf:type rdfs:Class ;  rdfs:subClassOf schema:Work ;  rdfs:comment "A listing that describes a job opening" .  schema:Employee  rdf:type rdfs:Class ;  rdfs:subClassOf schema:Work ;  rdfs:comment "An individual who provides work to a organization" .schema:Employer  rdf:type rdfs:Class ;  rdfs:subClassOf schema:Work ;  rdfs:comment "An organization or individual that hires employees" .schema:Organization  rdf:type rdfs:Class ;  rdfs:subClassOf schema:Work ;  rdfs:comment "An organized body of people with a common function" .schema:hasJobPosting  rdf:type owl:ObjectProperty ;  rdfs:domain schema:Organization ;  rdfs:range schema:JobPosting ;  rdfs:comment "A property indicating job postings of an organization" .schema:employedBy  rdf:type owl:ObjectProperty ;  rdfs:domain schema:Employee ;  rdfs:range schema:Organization ;  rdfs:comment "A property indicating the organization that an employee works for" .schema:employs  rdf:type owl:ObjectProperty ;  rdfs:domain schema:Employer ;  rdfs:range schema:Employee ;  rdfs:comment "A property indicating the employees who work for an employer" .```
Compose an ontology to represent the following: {noun}.		Compose an ontology to represent the following: Work.	Concept: WorkSub-Concepts:1. Occupation2. Productivity3. Employment4. Career5. Labor6. Performance7. Tasks8. Skills9. Pay/Wage10. Job roles11. WorkspaceProperties:1. Duration2. Nature (Part-time/Full-time)3. Type (White Collar/Blue Collar)4. Skills Required5. Salary Range6. Satisfaction Level7. Work-Life BalanceRelation:1. Work requires skills.2. Work offers Pay/Wage.3. Work involves tasks. 4. Work may lead to a career.5. Work is done in a workspace. 6. Work is categorized into an occupation.Instances:1. Doctor2. Engineer3. Teacher4. Lawyer5. Writer.
Compose an ontology to represent the following: {noun}.	 Provide it in valid Turtle/RDF format, excluding any extra text.	Compose an ontology to represent the following: Work. Provide it in valid Turtle/RDF format, excluding any extra text.	@prefix rdf: <http://www.w3.org/1999/02/22-rdf-syntax-ns#> .@prefix rdfs: <http://www.w3.org/2000/01/rdf-schema#> .@prefix xsd: <http://www.w3.org/2001/XMLSchema#> .@prefix owl: <http://www.w3.org/2002/07/owl#> .@prefix work: <http://www.example.org/ontology/work#> .work:Work rdf:type rdfs:Class ;          rdfs:label "Work"@en ;          rdfs:comment "Universal class for all kind of work activities"@en .work:Employee rdf:type rdfs:Class ;               rdfs:subClassOf work:Work ;             rdfs:label "Employee"@en ;             rdfs:comment "An individual who performs work for an employer"@en .work:Employer rdf:type rdfs:Class ;               rdfs:subClassOf work:Work ;             rdfs:label "Employer"@en ;             rdfs:comment "An entity that hires employees to perform work"@en .work:hasEmployee rdf:type rdf:Property ;                   rdfs:label "has employee"@en ;                 rdfs:comment "A relationship between an employer and its employee"@en ;                 rdfs:domain work:Employer ;                 rdfs:range work:Employee .work:performWork rdf:type rdf:Property ;                   rdfs:label "performs work"@en ;                 rdfs:comment "A relationship indicating the employee performs work for the employer"@en ;                 rdfs:domain work:Employee ;                 rdfs:range work:Employer .work:salary rdf:type rdf:Property ;              rdfs:label "salary"@en ;            rdfs:comment "The remuneration an employee receives for their work"@en ;            rdfs:domain work:Employee ;            rdf:range xsd:decimal .
Make an ontology that pertains to the following: {noun}.		Make an ontology that pertains to the following: Work.	1. Work    1.1 Types of Work        1.1.1 Full time work        1.1.2 Part time work        1.1.3 Remote work        1.1.4 Self-Employment        1.1.5 Freelance work        1.1.6 Contract work        1.1.7 Internships        1.1.8 Volunteer work    1.2 Work Environments        1.2.1 Office        1.2.2 Factory        1.2.3 Home office        1.2.4 Co-working spaces        1.2.5 Outdoor work stations    1.3 Work Roles        1.3.1 Employee        1.3.2 Manager        1.3.3 Executive        1.3.4 Team leader        1.3.5 Intern        1.3.6 Volunteer    1.4 Work Industries        1.4.1 Information Technology        1.4.2 Healthcare        1.4.3 Construction        1.4.4 Finance        1.4.5 Education        1.4.6 Manufacturing        1.4.7 Retail    1.5 Work Skills        1.5.1 Technical Skills         1.5.2 Soft Skills        1.5.3 Leadership Skills        1.5.4 Management Skills    1.6 Work Tools and Equipment        1.6.1 Computer        1.6.2 Office Stationery        1.6.3 Software Applications        1.6.4 Machinery    1.7 Work Policies        1.7.1 Attendance Policy        1.7.2 Leave Policy        1.7.3 Privacy Policy        1.7.4 Health and Safety Policy    1.8 Work Related Issues        1.8.1 Work Stress        1.8.2 Work-Life Balance        1.8.3 Job Security        1.8.4 Workplace Harassment    1.9 Employment Laws and Regulations    1.10 Work Compensation        1.10.1 Salary        1.10.2 Hourly wages        1.10.3 Benefits        1.10.4 Bonuses        1.10.5 Stock options        1.10.6 Retirement plans
Make an ontology that pertains to the following: {noun}.	 Provide it in valid Turtle/RDF format, excluding any extra text.	Make an ontology that pertains to the following: Work. Provide it in valid Turtle/RDF format, excluding any extra text.	```@prefix rdf: <http://www.w3.org/1999/02/22-rdf-syntax-ns#> .@prefix rdfs: <http://www.w3.org/2000/01/rdf-schema#> .@prefix owl: <http://www.w3.org/2002/07/owl#> .@prefix xsd: <http://www.w3.org/2001/XMLSchema#> .@prefix work: <http://www.example.org/work#> .work:Job a rdfs:Class ;    rdfs:label "Job"@en ;    rdfs:comment "A type of work that an individual has."@en .work:Employer a rdfs:Class ;    rdfs:label "Employer"@en ;    rdfs:comment "An entity that employs people."@en .work:Employee a rdfs:Class ;    rdfs:label "Employee"@en ;    rdfs:comment "An individual who is employed by an employer."@en .work:hasJob a rdf:Property ;    rdfs:domain work:Employee ;    rdfs:range work:Job ;    rdfs:comment "Indicates the job that an employee has."@en .work:employs a rdf:Property ;    rdfs:domain work:Employer ;    rdfs:range work:Employee ;    rdfs:comment "Indicates the individuals that an employer employs."@en .work:hasEmployer a rdf:Property ;    rdfs:domain work:Employee ;    rdfs:range work:Employer ;    rdfs:comment "Indicates the employer of an employee."@en .work:hasEmployee a rdf:Property ;    rdfs:domain work:Employer ;    rdfs:range work:Employee ;    rdfs:comment "Indicates the employees of an employer."@en .```
Could you develop a basic design pattern for representing {noun} in an ontology?		Could you develop a basic design pattern for representing Work in an ontology?	Sure, here's a basic example how you can design an ontology pattern for representing Work:1. Conceptual Component:   - Work: Overall concept of the ontology.   - Worker: A person or an entity performing the work.   - Workplace: The location where the work is performed.   - WorkType: The type or nature of the work.   - WorkStatus: The current status of the work, whether it's ongoing, completed, pending, etc.   - WorkDuration: The time taken or scheduled to complete the work.2. Properties:  - hasWorker: A property connecting Work to Worker.  - locatedAt: A property connecting Work to Workplace.  - hasType: A property connecting Work to WorkType.  - hasStatus: A property connecting Work to WorkStatus.  - hasDuration: A property connecting Work to WorkDuration.3. Hierarchy Structure:   - The top of the hierarchy would be the Work, and underneath it, we can have the worker, workplace, work type, work status, and work duration as subcategories. 4. Relationships:   - A Work is performed by a Worker.   - A Work is performed at a Workplace.   - A Work has a specific WorkType.   - A Work has a specific WorkStatus.   - A Work has a certain WorkDuration.5. Constraints and Rules:   - Every Work must have at least one Worker.   - Every Work is associated with one Workplace.   - Every Work is categorized into a specific WorkType.   - Every Work has one current WorkStatus.   - Every Work is associated with a WorkDuration.This pattern can be extended or modified according to the specific requirements of a particular domain. Different properties, entities and relationships can be added based on the complexities of the work being represented.
